{
  "$schema": "http://json-schema.org/draft-07/schema#",
  "title": "Experience",
  "type": "array",
  "items": {
    "type": "object",
    "required": ["company", "position", "start_date", "end_date", "location", "summary", "highlights"],
    "properties": {
      "company": { "type": "string" },
      "position": { "type": "string" },
      "start_date": { "type": "string" },
      "end_date": { "type": "string" },
      "location": { "type": "string" },
      "summary": { "type": "string" },
      "highlights": { "type": "array", "items": { "type": "string" } }
    }
  }
}
